"Я не хочу жить, я не потеряла смысл, когда мне было лет 14-15 меня в первые поситили мысли о смерти, но я как то старалась не думать об этом. Потом все чаще я стала думать о них, меня в школе все время обижали, обзывали, били, издевались. Я много раз говорила родителям но в ответ слышала ""не обращай внимание, и они лезть не будут"", ни какой поддержки от родителей. Я не с детства им не доверяла, в 1 классе умер дедушка, и сразу от нас ушёл папа. Мать все время пила, с самого рождения меня. Она бросала, уходила пить с друзьями своими. А папа все время работал ему тоже не донас было. И все моё детство прошло в ожидании любьви и тепла от родителей. Я мать с детства не навижу она много причинил боли. Она своих мужиков таскала к нам домой а они сидели и отдыхали, дрались ругались а я все это время боялась. Було много ситуаций, но здесь рассказать не могу. Потом меня и сестру забрала бабушка к себе жить, лет с 7 мы жили у неё. Он часто ругалась с мамой, а мне её было жалко я каждую ночь плакала и ждала мать. Но ей видимо было наплевать. Бабушка любьви не дала она тоже была занята своими делами, мы по душам не разу не говорили. И мне очень тяжело от этого сейчас. Я на родителей сильно обижена, за многое. Я каждый раз пытаюсь до них что-то до нести а в итоге, не чего. После каждого разговора с ними сидеть и плакать, и осознавать что ты не нужен им. И каждый раз слушать от них это, какая плохая я. Знать о том что мать не любит меня, и говорить о том что приеду и разобью все лицо и при этом ей не будет даже жалко меня. О том что все считаю то ты дура и образование тебе нужно, что ты не кому без него не нужна. Но при этом не понимая, чего хочу я, а я о чем мечтаю и о чем думаю, они даже не пытались понять, а мне уже не чего не хочется и не о чем не мечтаю. Говорить о том какая плохая дочь, не когда не думала что ты будешь такой, эгосткой, тварью, мразью, я тебя родила я тебя и удавлю. Знать о том когда меня мать рожала она чуть не умела, и после меня были последствия, и после них она больше не может иметь детей. Говорить о том какая я бессовесная, у меня нет сердца. Но при этом не когда не воспитывала мать, променять детей на другого мужчину, для меня это сильное предательство, бросив детей. Она взяла и уехала от нас, и приезжала раз в год и то на день рождения, чтобы с бабушкой поговорить, а нас прогоняли. А я потом сидела и плакала. Знать что рядом роднаяя сестра но при этом не ощущать этого, так как в детстве не научили, и выросло чувство ненависти к ней, потомучто её любили больше чем тебя, а я за все получала больше чем она, а мне доставалось за двоих. А я все время искала любовь и внимание, которого так не хватало и не хватает, но его нету не где. Я познакомилась с женщиной мы общались примерно год, она помогала выйти из этого состояния но я не могла, я так много глупостей наделала, я тогда не думала не о чем. Я пыталась наглотаться таблеток, руки резала, но ни чего не помогало. Этой женщине я буду благодарна всю жизнь, что она пыталась помочь и помогла на не которое время. Я познакомилась с девушкой лет 25, она так же помогала мне. Но дальше это не очень помогало. Я познакомилась с её детьми, 1 ребёнку 4 лет, другой 1 год. За все время общения с ней, а мы общаемся больше 3х лет, я полностью забыла о себе, и помогала ей. Мы стали друзьями. Ей тажело было справляться сомой. И тогда я для себя решила что не когда в жизни ей не в чем не откажу и буду помогать во преки себе. Сейчас мне 18, а я досейх пор не могу найти себя, и перестать думать о смерти. Я не понимаю зачем мне жить. С той девушкой мы стали меньше общаться ,меня это очень ранило, я много обижалась на неё. Потом искала отговорки что бы не приходить, но в тоже время я терзала себя, что я делаю и за чем я это делаю?! Сейчас я работаю, бросила колледж, переходила из одного в другой, работа вроде нравиться а вроде нет. Я не знаю что такое любовь, эмоции по отношению к другими. Я не понимаю свои чувства, я не хочу жить. У меня нет друзей, нет родных. И все они меня предали. И я понимаю что ни кому не нужна. Я злюсь срываюсь по пустякам. А в последнее время вообще стало на все плевать. Я завела собаку месяца 3 назад, я не думала не о чем, я знала что она будет моим другом. Но я не чувствую к ней не чего. Но не когда не куда не отдам, её. Хоть мне с ней и очень тажело. Мне не кто не помогает с ней, хотя живу с сестрой и бабушкой. Я больше не хочу не с кем общаться, я закрылась в себе. Я не могу так больше";1;0;1;1;1;0;1;1;0;1;0;1;1;1;1;1;0;0;0;1;1;1;1;1;1;1;0;0;0;0;0;0;0
Что делать если с каждым днём все больше и больше хочется совершить самоубийство?;1;0;0;0;0;0;0;0;0;0;0;0;0;0;0;0;0;0;0;0;0;0;0;0;0;0;0;0;0;0;0;0;0
Мне 14, Я умираю каждый день, все больше и больше, Я не чувствую себя живой. Честно много раз боролась за жизнь, но в итоге сдалась. Что мне делать, как убить себя? ;1;1;1;0;1;0;0;0;0;0;0;0;0;0;0;0;0;0;0;0;0;0;0;0;0;0;0;0;0;0;0;0;0
Что мне делать если я нахожусь с абьюзером и уйти от него не могу потому что, у меня эмоциональная привязанность.Поэтому для меня единственный способ-это выпить большую дозу снотворных.;1;0;1;0;1;0;0;0;0;0;0;0;0;1;0;0;1;0;0;0;0;0;0;0;1;0;0;0;0;0;0;0;0
Я не хочу жить. Мне 27 лет, я устала от тотального контроля своей матери. Она хочет забрать у меня сына, против моей 2 беременности, доводит до истерики чтобы случился выкидыш или преждевременные роды...Мечтаю умереть;1;1;0;0;1;0;0;0;0;0;0;0;0;0;0;0;0;0;0;0;0;0;0;0;1;0;0;0;1;0;0;0;0
Здравствуйте. Не вижу смысла существовать дальше, я очень давно в депрессии, год пью препараты, иногда бросаю. У меня был молодой человек, я его очень любила, возможно люблю до сих пор, но недавно узнала, что он меня жестоко обманывал, постоянно изменял, и при этом говорил мне что очень любит и обожает и скоро мы распишемся. Узнала когда приехала к нему со всеми вещами, с ребёнком 5 лет от первого брака. Уехали обратно. Сейчас у меня нет сил на жизнь. Не хочется жить, когда вижу, что у других жизнь продолжается, все делают что-то интересное, куда-то ездят, а у меня нет возможности сорваться развеяться, даже нет возможности погрустить одной, чтоб не дергал ребёнок. Меня задевает, что у предателя все прекрасно, а я чувствую себя слитой в унитаз. Я думала наконец нашла настоящую любовь, а на самом деле попала в лапы хладнокровного чудовища, я до сих пор не могу поверить в реальность происходящего.;0;1;1;1;1;0;1;0;0;0;0;0;0;1;0;0;0;0;0;0;0;1;0;0;0;0;0;0;0;1;0;0;0
"Добрый вечер. Хотел бы принести мои извинения за то что написал такой объем. ""Воды"" много, но оставлю все как есть, вероятно, будет пару важных аспектов.

Парень 17-и лет. Заканчиваю 11 класс. Планирую совершить суицид. Почему? Думаю, что физически я здоров. Обычный среднестатистический человек. Проблем в школе нет. С общением, наверное, тоже. С родственниками, конечно, ссоримся, но в пределах разумного. Чаще всего из-за моего отношения к жизни. Сложилось оно скорее всего из нескольких факторов. К слову, я понимаю, что я отнюдь не самый несчастный, обделенный или вроде того. Уверен, что есть люди пережившие куда больше меня и продолжающие жить и биться, если могу так выразиться, извините. Мои проблемы невероятно мелочные, возможно даже жалкие, но оказывают существенное влияние на меня. 

Не знаю, когда именно началась эта разъедающая душу хандра, но подозреваю, что с каждым днём она только разрастается и все больше разрушает мою жизнь. Я не из тех кто считает, что жизнь уже закончена. Скорей я предполагаю, что она была, есть и будет. Просто по-разному могла бы идти. Видимо, пошла не в ту сторону. Жаловаться на это просто нет смысла, сам виноват, признаю. Проявляется все это в основном в классических симптомах. Самый ярко выраженный - абсолютная апатия. Нет, я не хладнокровный, безэмоциональный овощ (как минимум в глазах общества), как это бывает. Я могу смеяться, плакать и так далее, но все эти эмоции, как бы странно не звучало, не мои, не настоящие, наигранные. Вполне вероятно, что я уже привык к роли, которую отыгрываю в социуме. Самопровозглашённый паяц. Так вот моя апатия она скорее внутренняя. Я не вижу смысла общаться с кем-то, идти куда-то, стремиться к чему-либо и тому подобное. Родители часто спрашивают: ""Чего ты хочешь?"". Мне нечего им ответить. Ведь я ничего не хочу. Сначала они вери, когда я отвечал ""Карьеру"" или ""Дом"" или ""Семью"". Но быстро поняли, что эти принятые обществом шаблонные цели мне безразличны. Тогда я перешел на ""Хочу, чтобы меня оставили в покое "". Они не в силах помочь и в этом я совершенно точно убежден. Бесспорно то, что их это бесит, но я не в силах ничего с этим поделать.

Мотивации нет. Все чаще я стал не понимать окружающих меня людей. Их поступки, их чувства, их жизнь становится чем-то необъяснимым для меня. Медленно, но верно это изолирует меня от общества. Воспитан я так, что ни с кем не делюсь своими переживаниями. Привык решать проблемы лишь в своей голове, обдумывая и рассуждая в слепой надежде совершенного решения, ведущего к наилучшему из возможных исходу. Вероятно это имеет накопительный эффект.

 Возвращаясь ближе к теме, хочу заметить, что под термин ""апатия"" я решил положить все, как я считаю, вытекающие симптомы. 

Как я упоминал ранее, мне сложно что-либо чувствовать, я скорее понимаю, что должен испытывать. Удовольствие или недовольство. Звучит надменно и банально, но мне равнодушно практически всё. Знаю, что не должен говорить такое, но я не сомневаюсь, если умер бы близкий мне человек, то я бы скорбил только внешне, но в действительности не почувствовал бы и капли огорчения. Существует выражение ""Потерял вкус к жизни"". Думаю, это что-то близкое к моему случаю. 

Я не только не вижу смысла продолжать влачить с каждым годом все более жалкое существование, но и не хочу. Потому что оно обременяет меня. Тяжело, как в выражении ""камень на душе"". Я не из ряда ""моя жизнь только создает проблем окружающим"". Мне безразлично, но раз уж на то пошло, я не создаю никому проблем. Моя жизнь быстро дошла до того, что все время я либо сплю, либо читаю, либо смотрю сериал... надеюсь, вы поняли к чему я клоню. Мой подход стал схож с позицией одного героя: ""Если я не должен что-то делать, я не буду. Если я должен что-то сделать, сделаю это по-быстрому"". Только у меня это похоже срослось с юношеским максимализмом. Нет, я не стараюсь косить под вымышленных персонажей. Просто нахожу в немногих черты своего случая. Ведь через всем доступных героев можно докричаться до толпы. Проза и кинематограф (куда я отношу и сериалы) помогают скрасить мою бесцветную жизнь, не отрицаю. Словно проживаешь в лице протагониста во время прочтения. 

Голод я чувствую, но есть не хочу. Думаю, что жил бы в одиночестве, давно бы умер либо от истощения, либо от обезвоживания. Расстройство пищеварительного поведения уж наверняка имеется. Не могу сказать, что меня это волнует скорее осознание того, что что-то не так, дает о себе знать.

Много искал точный диагноз, но так и не могу уверенно что-либо высказать на этот счёт. Лишь самое размытое, например это психическое отклонение. Депрессия, шизоидное расстройство личности, биполярное расстройство - частично имеются симптомы от каждого. Знаю, играть в самопровозглашённого психолога очень гиблая затея, но мне важно знать что это и как это лечится. Я бы с радостью проверился у психотерапевта на наличие серьёзных психических отклонений. Почему раньше не ходил? Потому что мне было непонятно, я не верил, что человек может точно выявить психические расстройства. По крайней мере те психологи, что я был вынужден пройти, сложили данное впечатление.

Думаю, что более серьёзные симптомы (при их наличии) стоит говорить только на приеме. Надеюсь, вы меня понимаете. 

Еще раз прошу прощения за такие объём, формат и стиль написания. Мне было необходимо выговориться, хотя и считаю, что это далеко не все и вряд ли даст осознание полной картины моей проблемы. Спасибо, если это было прочитано. ";1;0;1;1;1;0;1;1;0;0;0;0;0;1;0;0;0;0;0;0;0;1;0;0;1;0;0;0;0;0;0;1;0
Здравствуйте, мне 16 .  Недавно мой отчим убил котёнка , это очень травмировало меня, я впала в депрессию . Отчим убил котёнка мама вызвала полицию , мы все разобрались и он ушёл , но я не знала куда , мне было плевать главное , чтобы никогда его не видеть. Сегодня я решила покончить с собой , когда узнала , что моя бабушка приютила его у себя дома . Мне стало очень обидно ведь бабушка по факту приютила убийцу( он был рад когда убил котёнка, он повернулся и улыбался мне). Я кричала на бабушку зачем она это сделала, но мама на стороне бабушки и так всегда , мама всегда защищает мужчину , на мою сторону она никогда не становилась , а я в первую очередь всегда ее защищала  даже если она была не права. Вот я одевалась после ссоры с бабушкой и мамой и они увидели , что я взяла нож. Я правда хотела убить отчима и я понимала что меня могут посадить, но они забрали его у меня , я начала манипулировать ими , что если он не уйдёт из дома бабушки , то я убью либо себя либо его. Зашла в ванну взяла лезвие и начала резать руки , потом зашла мама и сказала , что немного крови полезно выпустить. Это окончательно добило меня . Мне очень плохо я в безвыходной ситуации , что делать не знаю , но знаю одно что убью себя .;1;0;1;1;1;0;0;1;0;0;0;0;0;1;1;1;0;0;0;0;1;0;0;0;1;0;0;0;0;0;0;0;0
"Я хочу умереть я не хочу жить в этом мире
Меня каждый день унижают оскорбляют любят только братика меня ненавидят унижают ";1;1;0;0;1;0;0;0;0;0;0;0;0;0;0;0;0;0;0;0;0;0;0;0;1;0;0;0;0;0;0;0;0
я не понимаю что со мной. возможно,я себя накручиваю,но пожалуйста послушайте меня в последнее время,я начала замечать,что со мной что то не так. у меня пропало желание жить,я не вижу смысла в этой жизни моя мать,очень давит на меня,из за нее у меня были и есть многочисленные истерики,панические атаки,желание суицида. я множество раз вскрывала себе Вены,пыталась наесться таблетками,2 раза пыталась сброситься с окна. мои родители,грозились тем,что положат меня в психушку,мне очень плохо морально из за всего того что на меня давит. мне всего 13 лет,а я уже имею такие мысли,я проходила онлайн психологические тесты,и тесты на суицидальные риск,он оказался очень высок я часто теряюсь в себе,мне будет проще совсем исчезнуть,чем взваливать на себя эти проблемы. я не хочу ничего видеть,слышать,чувствовать,понимать,я хочу лишь закрыться в себе и забыть все через что я прошла.;0;1;1;1;1;0;0;1;0;0;0;1;0;1;0;0;0;0;0;0;0;1;0;0;1;0;0;0;0;0;0;0;0
Здравствуйте мне 12 и в последние время мне очень хочется умереть.в школе начали избивать и издеваться, дома на меня внимание не обращают кричат на меня по пустикам.резко меняется настроение, могу в любой момент заплакать или засмеяться как резаная. Не раз уже пыталась умереть но меня останавливали говоря что я ненормальная. Руки у меня уже все изуродованы помогите пожалуйста....;1;1;0;1;1;0;0;0;0;0;0;1;0;0;0;0;1;0;0;0;0;0;0;0;1;0;0;0;0;0;0;0;0
