"Здравствуйте! Меня зовут Алексей, мне 32, в настоящее время разведён, - растут 2 сына, которые живут с бывшей женой. На данный момент нигде не работаю, в 25 лет получил 2-ю группу по психическому заболеванию. Мог получить и раньше, но не хотел, т.к. считал, что это унизительно и будет психологически подавлять меня. Но так или иначе пришлось это сделать, так как была семья, а заработок не был постоянным и стабильным. В то время я снимал свадьбы, юбилеи, занимался видеомонтажём, подрабатывал временами на стройке. Женился в 22. Мне всегда было трудно общаться с людьми, с детства чувствовал себя каким-то не как все мои сверстники-чудаковатым, замкнутым. Это порою очень сильно угнетало меня. 3 года назад вышло так, что развелись с женой и теперь живём отдельно друг от друга. Прожили совместно 9 лет... Тогда меня уволили, так как был кризис и многих сокращали - работал в мебельном цеху, на сборке. Проработал там 1 год и надо сказать, что это был самый большой срок, который я выдержал на постоянной работе в коллективе. Видеосъёмка ведь ""снял и ушёл"", -не каждый день, а порой и не каждый месяц. Почти то же самое и с временной подработкой на стройках. А здесь - это была победа, но то, что уволили... После этого сильно ухудшилось состояние - перестал встречаться с людьми, ещё более стал замкнутым, перестал доверять людям, усилилась депрессия, заметно похудел. После развода побывал с родителями и братом в Египте, Израиле, Индии, но это мало помогло-я до сих пор не могу устроиться на работу. Мучает сильная депрессия и ощущение нереальности, всё как-то мутно воспринимаю и свою собственную личность как не свою... Как-то так. В конце прошлого года произошла трагическая история - я стал увлекаться спиртным и нас с знакомым сильно избили ночью какие-то отморозки. Я плохо помню с чего и как началось. Мой знакомый через несколько дней умер... А я в тот день спасся бегством. Звонил ему потом каждый день, но никто не брал трубку... Я не знал, что так печально всё закончится... Меня тоже сильно избили, но родители отвезли в больницу, где вправили сломанный нос, выписали мази на лицо. т.к. были сильные ушибы и гематомы -сильно били по голове ногами... После смерти знакомого я понял, что не буду больше таким как раньше никогда - чувствовал себя предателем, что убежал... Вызывали и в полицию - могли и меня обвинить в том, что это я избил, так как тех извергов естественно не нашли... Тогда не находил себе места-возник сильный, даже граничащий с безумием страх попасть в тюрьму. Жуткое ощущение надо заметить - потом оно долго не проходило, лишь последние месяцы стало понемногу утихать. Но усилились состояние депрессии-мой психиатр поставил диагноз ""Большое депрессивное расстройство"". На настоящий момент я сильно ""сдал"" - вообще бегу от всякого общения, боюсь жизни, самого себя, в душе (наверное стоит это признать) презираю свою личность... И ничего не могу с этим поделать, ведь изменить прошлое мы не в силах. Боюсь выходить на улицу - кажется, что люди смотрят на меня и осуждают, злорадно смеются. Это было и раньше, но сейчас усугубилось. Постоянно мутно в голове и такое ощущение, что жизнь прожита. Бывают мысли о самоубийстве. За время первого посещения психиатра в 15 лет принимал много препаратов: анафранил, людиомил, коаксил, амитриптилин, флуоксетин, этаперазин, трифтазин, литий, транксен, ксанакс, различные ""нооотропы"", седуксен, реланиум, фенозепам (к нему развилась зависимость-принимаю по по 2-3 т. в день. Таблетки по 1 мг.), феварин, хлорпротиксен. Полтора года назад последний раз лежал в платном отделении неврозов при областной психиатрической больнице. Тогда врач выписывал симбалту утром, сероквель на ночь, фенибут 2 раза в день. Последний раз посещал своего психиатра в начале мая - выписала вальдоксан на ночь, сероквель 25-50 мг в день, пикамилон в таблетках. Вальдоксан как-то не пошёл-понял, что не мой препарат. На данный момент принимаю сероквель по 50 мг на ночь, симбалту 30 мг и феноземам 2-3 мг утром.
Но такое ощущение, что мой организм и иммунитет очень ослабли, нет желания жить дальше, устал, ""всё пусто"" и скоро умру... Всё надоело и я не выйду из этого состояния уже никогда...";0;1;1;1;1;0;1;0;0;1;1;0;0;1;0;0;1;0;1;1;1;1;1;1;0;1;0;1;1;0;0;0;0
"Здравствуйте,меня зовут Анна,33 года....Начну сначала.На протяжении 4 лет у меня были отношения с одним мужчиной,ну как отношения,он то появлялся в моей жизни,то изчезал,а я ждала.В итоге он ушел к другой,я все сделала,чтобы его вернуть,вернула,но заранее зная,что мы все равно вместе не будем,он опять уйдет,это какие-то болезненные отношения,мы и вместе не можем и без него я погибаю.У меня какая-то патологическая зависимость от него,он как воздух,если он пару дней не появлялся,я с ума сходила от ревности и боли...2 месяца назад он опять нашел себе другую,но и меня не отпускает,в этот раз со мной что-то случилось,или просто настал предел. Я уже как 2 недели не могу есть,насильно впихиваю в себя пищу,спать,засыпаю только от усталости организма и то на пару часов,снятся кошмары,просыпаюсь в слезах и бегу к телефону.-а вдруг позвонит.,плюнула на все,ничего не интересно,с работы уволилась,сижу безвылазно дома,в котором все уже грязью поросло,а убирать зачем?даже,простите,не моюсь,а зачем? и самое страшное,я стала пить,вот так и проходят дни,сижу,жду его,он звонит, рассказывает какая хорошая его новая девушка,но любит он меня... оставшееся время рыдаю,и чтоб заглушить боль выпиваю....последнее время стали посещать мысли о самоубийстве,он был смыслом моей жизни,нет его-нет жизни...как мне избавиться от этой зависимости?я правда уже боюсь,что дойду до предела,а у меня старенькие родители,им помогать надо,но жить как сейчас я живу больше не возможно...
";1;0;1;1;1;0;1;0;0;1;0;0;0;1;0;1;1;0;1;0;1;1;1;0;0;0;0;0;0;1;1;1;1
"Здравствуйте. Мне 21 год, я в 19 лет перенес энцефаломиелит, все еще лечусь. И у меня, походу, поехала крыша, так как было поражение мозга и цнс. Я два раза лежал в психушке в прошлом году, так как находился в состоянии депрессии. Стал через день употреблять алкоголь, особенно дешевое пойло из ларька в баночках в перемешку с пивом, нажираюсь в зюзю. Врач-психиатр прописывал пить эглонил утром 50мг, неулептил в капсулах на ночь. Я под этими таблектами где-то год принимаю алкоголь 3 раза в неделю и накуриваюсь иногда. И у меня очень плохо стало психически, как выпью, приду домой - мне мерещутся шаги, звуки, я попадаю в фильм ужасов, за мной охотятся инопланетяне. Меня всего трясет от страха и ужаса. С похмелья я всего боюсь, но за мной никакие зомби и скелеты не охотятся. А вот если не пью алкоголь, а просто принимаю эглонил и неулептил, то весь мир уже вот с 19 лет кажутся нереальными, как будто это не моя жизнь, я кино смотрю как мое тело что-то делает, а я на самом деле сплю. С каждым месяцем пьянки все хуже у меня психически, я по улице даже трезвый уже иду, мне кажется - люди на меня смотрят и хотят убить, или против меня заговор ФСБ, так как они думают, что я агент ЦРУ.
Еще дело в том, что я учусь в институте, но меня там считать стали за психопата - у меня говорят, глаза стеклянные и в точку смотрят часто, поведение неадекватное. Я могу смеяться без причины или погрузиться в транс, не замечаю как время проходит даже. Очень сильно торможу на практических занятиях. В общем, со мной уже 2 года никто не общается!! А я раньше имел много друзей и был оптимистичный. Сейчас у меня такое ощущение, что меня подменили, что все нереально и не со мной происходит. Я много гуляю ночью пьяный, чтобы меня зарезали, иногда залазию на электровышку, хочу умереть, но как просплюсь, меня кидает в ужас, умирать ведь страшно.
Мне кажется, я оказался в АДУ в прямом смысле. Помогите, я нормальным пацаном был, а стал психопатом каким-то.";0;1;1;1;1;0;1;0;0;1;1;0;0;0;0;1;0;0;1;0;1;1;1;0;0;0;0;1;0;0;0;0;0
"Здравствуйте, мне 20 лет, студентка, не замужем. Я давно хотела бы обратиться к специалисту чтобы высказать все что есть, потому что иногда кажется что мне нужна помощь. Скажите стоит ли на самом деле к кому либо обращаться? Или что вообще делать?
Я никогда не имела много друзей, обычно это приходящие и уходящие люди. Почему то кажется что они все общаются со мной из-за какой-то выгоды, на худой конец ради веселого времяпровождения.
Очень коробит одиночество, в последнее время постоянно ощущение никчемности, часто посещают мысли что было бы лучше умереть, часто я это озвучиваю приятелям каким именно образом я бы себя убила, они ругаются.
Еще помню совсем в малом возрасте примерно в 8 лет я хотела по какой то причине зарезать себя, даже уже тыкала рукояткой в живот, но передумала.
Приобщении с людьми я обычно забываю про угнетенность, но едва оставшись одной хочется плакать снова. Очень часто подходя с учебы к дому у меня резко ухудшается настроение, дома не хочется ни с кем разговаривать, а хочется плакать, было что я приходила домой садилась в угол и плакала, причитая о ненужности моей жизни. Хочется себя ударить, сделать больно физически, но тяги к порезам вен, например, нет и не было.
Часто очень резко меняется настроение, причем в общественном месте могу заплакать, затеять истерику, а если смех, то очень громкий, мне важно чтобы слышали и видели все окружающие. Вообще люблю играть на публику, но только положительные эмоции, отрицательные никогда.
Очень много слушаю музыку. Часто мне нравится послушать нечто заупокойное, угнетающее, причем это вызывает удовольствие. Обычно в текстах песен я ищу строки которые описывают мое настоящее состояние и грущу под них, крича внутри себя. Еще я фанатка, очень сильно переживаю за любимых музыкантов, если что-то не так. Или с катанием по полу от радости или с рыданием.
Весной было так же и кажется еще тяжелее даже. Была в постоянном ступоре, на обращение ко мне не было желания даже повернуть голову и посмотреть не то что ответить. Иногда казалось как будто я находилась в стеклянном прямоугольнике, мутная плоскость с пупырышками давила мне на левую сторону лица, а до стекла по правую сторону я не могла дотянуться, оно было поодаль и через него я смотрела на окружающий мир. иногда давящие стороны менялись. До сих пор иногда находит это ощущение. Я тогда стала пить Флуоксетин, но от него очень тошнило и я бросила, состояние стало чуть легче, возможно потому что я стала мало находиться одна и много гуляла.
Самое главное, наверное, что меня беспокоит уже очень давно это вымышленные друзья. Я их придумала примерно в 12 лет и они остались со мной до сих пор. Причем это не просто человечки с которыми я сажусь покушать или что-то подобное, а я придумала целый второй мир где я живу по другому, другие друзья и масса приятелей, придумываю всякие разборки и истории которые там происходят. Вообще все это тяжело объяснить. Сам сценарий жизней этих, менялся с 12 лет несколько раз. Последняя длится уже почти 4 года. Я пыталась оставить все это, но ничего не получилось, мне просто скучно.
Еще в последнее время стала замечать что мне нравится когда я грущу и стараюсь находить поводы для этого, а они всегда находятся и это тоже беспокоит.";1;0;1;1;1;0;1;0;0;0;1;0;0;0;0;0;0;0;0;0;0;0;0;0;0;0;0;0;0;0;0;0;0
"пол года назад меня сбила машина и я до сих пор жалею что все обошлось переломом. с детства меня не покидают мысли о самоубийстве, но для себя я решила что сама этого не сделаю никогда. кажется что эта авария была моим единственным шансом перестать существовать в каше, которой погрязла.
все мое существование представляется кашей, серой, бесформенной массой. бескрайнем дремучем лесом в котором заблудилась.

у меня почти нет чувств. не переживаю, не радуюсь. но иногда вспыхивают какие-то отрицательные эмоции - гнев или обида, которые проходят через несколько минут. нет мыслей. внутри сплошная пустота. кажется что я смотрю на себя со стороны и не могу управлять тем что делаю. поэтому выполняю только какие-то механические действия: чищу зубы, кушаю, одеваюсь, включаю компьютер. кажется что внутри все запрограммировано, причем не мной. мне ничего не интересно. ничем не увлекаюсь кроме чтения. все валится из рук. сплошная слабость. тошнит собой.

год назад я бросила университет. я не могла ничего учить, если я пыталась сесть за учебу, то голова становилась ватной и я не могла сконцентрироваться. отучилась полтора года и написала заявление об отчислении. от этого мне стало легче, будто сбросила с себя груз который тянул ко дну.


я не знаю когда это началось и думала что это мое нормальное состояние. недавно наткнулась на определение деперсонализации и поняла что такие состояния как у меня лечатся.

хотелось бы получить ответ: заболевание ли это?";1;0;1;1;1;0;1;0;0;0;0;0;1;0;0;0;0;0;0;0;1;1;1;0;0;0;0;0;0;0;0;0;0
"1. Достала чертова депра, в краткие периоды ясного рассудка понимаю что можно что то как то попытатся изменить жизнь в лучшую сторону, но не хватает внешней подпитки - в качестве которой может выступить химия.
2. 19 лет, студиозус
3. Тихо шифером шурша...Нестабильность психики - резкая маятниковая смена настроения от суицидально - депрессивного, либо апатично-вялого скачкообразно к приступам истеричного веселья. Периодически видимо в результате депры прессует ВСД с тахикардией и всеми радостями (беспричинное паническое состояние, сильнейшая зашкаливающая тревожность, замедление и нечленораздельность речи, смазанная обьективная реальность перед глазами). Отсутствие интереса к чему бы то ни было. В периоды апатии повышенная сонливость (уход в сон как вариант единственно возможный).
4. С прошлого лета. Причина - утрачена цель в жизни. Начисто сожженная мотивация, в периоды особо острых приступов депресии склонность к суициду. Самоизоляция.

Требуется хороший антидепрессант, возможно в безрецептурном отпуске, рецептурные тоже пойдут.
Спасение утопающих..";1;0;1;1;0;0;1;0;0;1;0;0;0;0;0;0;0;0;0;0;0;0;0;0;0;0;0;0;0;0;1;0;0
